{
  "project": {
    "name": "BESS Project Finance Model",
    "type": "BESS",
    "currency": "AUD",
    "financialYearEnd": 6
  },
  "timeline": {
    "startYear": 2027,
    "startMonth": 4,
    "endYear": 2060,
    "endMonth": 3
  },
  "keyPeriods": [
    {
      "id": 1,
      "name": "Construction",
      "generates": "F1",
      "periods": 18,
      "startAnchor": "timeline.start",
      "startYear": 2027,
      "startMonth": 4,
      "endYear": 2028,
      "endMonth": 9
    },
    {
      "id": 2,
      "name": "Total Operations",
      "generates": "F2",
      "periods": 300,
      "startAnchor": "F1.End",
      "startOffset": {
        "value": 1,
        "unit": "months"
      },
      "startYear": 2028,
      "startMonth": 10,
      "endYear": 2053,
      "endMonth": 9,
      "isGroup": true,
      "childIds": [
        3,
        4,
        5
      ]
    },
    {
      "id": 3,
      "name": "Normal Operations",
      "generates": "F3",
      "periods": 240,
      "startAnchor": "F1.End",
      "startOffset": {
        "value": 1,
        "unit": "months"
      },
      "startYear": 2028,
      "startMonth": 10,
      "endYear": 2048,
      "endMonth": 9,
      "parentGroupId": 2
    },
    {
      "id": 4,
      "name": "Life Extension",
      "generates": "F4",
      "periods": 60,
      "startAnchor": "F3.End",
      "startOffset": {
        "value": 1,
        "unit": "months"
      },
      "startYear": 2048,
      "startMonth": 10,
      "endYear": 2053,
      "endMonth": 9,
      "parentGroupId": 2
    },
    {
      "id": 5,
      "name": "Terminal Value",
      "generates": "F5",
      "periods": 1,
      "startAnchor": "F4.End",
      "startYear": 2053,
      "startMonth": 9,
      "endYear": 2053,
      "endMonth": 9,
      "parentGroupId": 2
    },
    {
      "id": 9,
      "name": "Revenue Periods",
      "generates": "F9",
      "periods": 300,
      "startAnchor": "timeline.start",
      "startYear": 2028,
      "startMonth": 10,
      "endYear": 2053,
      "endMonth": 9,
      "isGroup": true,
      "childIds": [
        6,
        7
      ]
    },
    {
      "id": 6,
      "name": "Offtake",
      "generates": "F6",
      "periods": 120,
      "startAnchor": "F3.Start",
      "startYear": 2028,
      "startMonth": 10,
      "endYear": 2038,
      "endMonth": 9,
      "parentGroupId": 9
    },
    {
      "id": 7,
      "name": "Merchant",
      "generates": "F7",
      "periods": 180,
      "startAnchor": "F6.End",
      "startOffset": {
        "value": 1,
        "unit": "months"
      },
      "startYear": 2038,
      "startMonth": 10,
      "endYear": 2053,
      "endMonth": 9,
      "parentGroupId": 9
    },
    {
      "id": 10,
      "name": "Debt Facilities",
      "generates": "F10",
      "periods": 234,
      "startAnchor": "timeline.start",
      "startYear": 2027,
      "startMonth": 4,
      "endYear": 2046,
      "endMonth": 9,
      "isGroup": true,
      "childIds": [
        11,
        8
      ]
    },
    {
      "id": 11,
      "name": "Construction Facility",
      "generates": "F11",
      "periods": 18,
      "startAnchor": "F1.Start",
      "startYear": 2027,
      "startMonth": 4,
      "endYear": 2028,
      "endMonth": 9,
      "parentGroupId": 10
    },
    {
      "id": 8,
      "name": "Ops Debt",
      "generates": "F8",
      "periodsFromRef": "C1.27",
      "periods": 216,
      "startAnchor": "F1.End",
      "startOffset": {
        "value": 1,
        "unit": "months"
      },
      "startYear": 2028,
      "startMonth": 10,
      "endYear": 2046,
      "endMonth": 9,
      "parentGroupId": 10
    },
    {
      "id": 12,
      "name": "Maintenance",
      "generates": "F12",
      "periods": 36,
      "startAnchor": "timeline.start",
      "startYear": 2042,
      "startMonth": 10,
      "endYear": 2045,
      "endMonth": 9
    },
    {
      "id": 13,
      "name": "Refi 1 (Y5)",
      "generates": "F13",
      "periods": 1,
      "startAnchor": "timeline.start",
      "startYear": 2032,
      "startMonth": 4,
      "endYear": 2032,
      "endMonth": 4
    },
    {
      "id": 14,
      "name": "Refi 2 (Y10)",
      "generates": "F14",
      "periods": 1,
      "startAnchor": "timeline.start",
      "startYear": 2037,
      "startMonth": 4,
      "endYear": 2037,
      "endMonth": 4
    },
    {
      "id": 15,
      "name": "Refi 3 (Y15)",
      "generates": "F15",
      "periods": 1,
      "startAnchor": "timeline.start",
      "startYear": 2042,
      "startMonth": 4,
      "endYear": 2042,
      "endMonth": 4
    },
    {
      "id": 16,
      "name": "Refi 4 (Y20)",
      "generates": "F16",
      "periods": 1,
      "startAnchor": "timeline.start",
      "startYear": 2047,
      "startMonth": 4,
      "endYear": 2047,
      "endMonth": 4
    }
  ],
  "indices": [
    {
      "id": 2,
      "name": "CPI (2.5%)",
      "ref": "I2",
      "rate": 2.5,
      "period": "annual",
      "startYear": 2026,
      "startMonth": 1
    }
  ],
  "inputGroups": [
    {
      "id": 100,
      "name": "Constants",
      "ref": "C1",
      "refIndex": 1,
      "mode": "constant",
      "frequency": "Y",
      "groupType": "constant",
      "entryMode": "constant",
      "subgroups": [
        {
          "id": 1,
          "name": "Plant"
        },
        {
          "id": 2,
          "name": "Revenue"
        },
        {
          "id": 3,
          "name": "Tax & Accounting"
        },
        {
          "id": 4,
          "name": "Working Capital"
        },
        {
          "id": 5,
          "name": "Debt"
        },
        {
          "id": 6,
          "name": "Reserves & Cash"
        },
        {
          "id": 7,
          "name": "Valuation"
        },
        {
          "id": 8,
          "name": "Technical"
        }
      ],
      "startYear": 2027,
      "startMonth": 4,
      "endYear": 2053,
      "endMonth": 9,
      "lookupStartYear": 2027,
      "lookupStartMonth": 4,
      "lookupEndYear": 2060,
      "lookupEndMonth": 3
    },
    {
      "id": 1,
      "name": "CAPEX",
      "ref": "V1",
      "refIndex": 1,
      "mode": "values",
      "frequency": "M",
      "linkedKeyPeriodId": "1",
      "groupType": "combined",
      "startYear": 2027,
      "startMonth": 4,
      "endYear": 2028,
      "endMonth": 10,
      "lookupStartYear": 2027,
      "lookupStartMonth": 4,
      "lookupEndYear": 2028,
      "lookupEndMonth": 9
    },
    {
      "id": 2,
      "name": "OPEX",
      "ref": "S1",
      "refIndex": 1,
      "mode": "series",
      "frequency": "Y",
      "linkedKeyPeriodId": "2",
      "groupType": "combined",
      "entryMode": "series",
      "startYear": 2028,
      "startMonth": 10,
      "endYear": 2053,
      "endMonth": 9,
      "lookupStartYear": 2028,
      "lookupStartMonth": 10,
      "lookupEndYear": 2053,
      "lookupEndMonth": 9
    },
    {
      "id": 3,
      "name": "Market Prices",
      "ref": "L1",
      "refIndex": 1,
      "mode": "lookup",
      "frequency": "Y",
      "linkedKeyPeriodId": "custom",
      "groupType": "combined",
      "entryMode": "lookup",
      "subgroups": [
        {
          "id": 1,
          "name": "Arbitrage ($/MW)"
        },
        {
          "id": 2,
          "name": "FCAS ($/MW)"
        }
      ],
      "selectedIndices": {
        "1": 1,
        "2": 1
      },
      "selectedInputIds": {
        "1": 105,
        "2": 107
      },
      "showSelected": true,
      "startYear": 2027,
      "startMonth": 4,
      "endYear": 2055,
      "endMonth": 12,
      "lookupStartYear": 2027,
      "lookupStartMonth": 4,
      "lookupEndYear": 2060,
      "lookupEndMonth": 3
    },
    {
      "id": 6,
      "name": "Interest Rates",
      "ref": "L2",
      "refIndex": 2,
      "mode": "lookup",
      "frequency": "Q",
      "linkedKeyPeriodId": "custom",
      "groupType": "combined",
      "entryMode": "lookup",
      "selectedInputIds": {
        "root": 31
      },
      "startYear": 2027,
      "startMonth": 4,
      "endYear": 2065,
      "endMonth": 12,
      "lookupStartYear": 2027,
      "lookupStartMonth": 4,
      "lookupEndYear": 2060,
      "lookupEndMonth": 3
    },
    {
      "id": 7,
      "name": "Performance Factors",
      "ref": "L3",
      "refIndex": 3,
      "mode": "lookup",
      "frequency": "Y",
      "linkedKeyPeriodId": "custom",
      "groupType": "combined",
      "entryMode": "lookup",
      "selectedInputIds": {
        "root": 32
      },
      "showSelected": false,
      "startYear": 2028,
      "startMonth": 10,
      "endYear": 2045,
      "endMonth": 12,
      "lookupStartYear": 2028,
      "lookupStartMonth": 10,
      "lookupEndYear": 2053,
      "lookupEndMonth": 9
    },
    {
      "id": 8,
      "name": "Maintenance",
      "ref": "S2",
      "refIndex": 2,
      "mode": "series",
      "frequency": "Q",
      "linkedKeyPeriodId": "12",
      "groupType": "combined",
      "entryMode": "series",
      "startYear": 2042,
      "startMonth": 10,
      "endYear": 2045,
      "endMonth": 9,
      "lookupStartYear": 2042,
      "lookupStartMonth": 10,
      "lookupEndYear": 2045,
      "lookupEndMonth": 9
    },
    {
      "id": 101,
      "name": "Agency Fee",
      "ref": "S3",
      "refIndex": 3,
      "mode": "series",
      "frequency": "M",
      "linkedKeyPeriodId": "10",
      "groupType": "combined",
      "entryMode": "series",
      "selectedInputIds": {},
      "startYear": 2027,
      "startMonth": 4,
      "endYear": 2048,
      "endMonth": 9,
      "lookupStartYear": 2027,
      "lookupStartMonth": 4,
      "lookupEndYear": 2048,
      "lookupEndMonth": 9
    }
  ],
  "inputs": [
    {
      "id": 100,
      "groupId": 100,
      "name": "Capacity (MW)",
      "ref": "C1.1",
      "subgroupId": 1,
      "inputId": "operations.capacity_mw",
      "mode": "constant",
      "value": 70,
      "unit": "MW"
    },
    {
      "id": 101,
      "groupId": 100,
      "name": "Storage Hours",